{"meta":{"date":"2026-10-23","generated_at":"2026-10-24T13:29:17.357339+00:00","season":"2026"},"scores":[{"away":"TB","away_score":2,"home":"MIL","home_score":3,"final":true,"tag":null}],"storylines":[{"matchup":"TB @ MIL","score":"2-3","tag":null,"body":"Tampa Bay Rays 2, Milwaukee Brewers 3. Jacob Misiorowski earned the win. Key moment: Jonny DeLuca strikes out swinging.."}],"tonight":[{"matchup":"TB @ MIL","broadcast":"FOX / FOX ONE","note":"The Tampa Bay Rays look to bounce back after an opening loss as they visit the Milwaukee Brewers, who sit at 1-0 following their season-opening victory. Drew Rasmussen takes the mound for Tampa Bay against Milwaukee's Logan Henderson in this nationally televised matchup on FOX."}],"transactions":[{"team":"Milwaukee Brewers","type":"IL","player_id":605540,"player":"Brandon Woodruff","pos":null,"detail":"Milwaukee Brewers activated RHP Brandon Woodruff from the 60-day injured list."}],"leaderboards":{"hot_hitters":[{"rank":1,"player_id":650490,"player":"Yandy D\u00edaz","team":"TB","avg":0.269,"hr":2,"rbi":4,"ops":0.875,"obp":0.259,"slg":0.615,"games":6,"pa":27,"sb":0,"window":"7-day"},{"rank":2,"player_id":802415,"player":"Chandler Simpson","team":"TB","avg":0.35,"hr":0,"rbi":3,"ops":0.848,"obp":0.348,"slg":0.5,"games":6,"pa":23,"sb":3,"window":"7-day"},{"rank":3,"player_id":666018,"player":"Jonathan Aranda","team":"TB","avg":0.348,"hr":0,"rbi":3,"ops":0.718,"obp":0.37,"slg":0.348,"games":6,"pa":27,"sb":0,"window":"7-day"},{"rank":4,"player_id":691406,"player":"Junior Caminero","team":"TB","avg":0.273,"hr":1,"rbi":3,"ops":0.905,"obp":0.36,"slg":0.545,"games":6,"pa":25,"sb":0,"window":"7-day"},{"rank":5,"player_id":689414,"player":"Liam Hicks","team":"TB","avg":0.263,"hr":0,"rbi":5,"ops":0.596,"obp":0.333,"slg":0.263,"games":6,"pa":21,"sb":0,"window":"7-day"},{"rank":6,"player_id":800050,"player":"Chase DeLauter","team":"CLE","avg":0.278,"hr":0,"rbi":3,"ops":0.77,"obp":0.381,"slg":0.389,"games":5,"pa":21,"sb":0,"window":"7-day"},{"rank":7,"player_id":663993,"player":"Nathaniel Lowe","team":"CLE","avg":0.235,"hr":0,"rbi":2,"ops":0.572,"obp":0.278,"slg":0.294,"games":5,"pa":18,"sb":0,"window":"7-day"},{"rank":8,"player_id":680757,"player":"Steven Kwan","team":"CLE","avg":0.286,"hr":0,"rbi":0,"ops":0.604,"obp":0.318,"slg":0.286,"games":5,"pa":22,"sb":0,"window":"7-day"},{"rank":9,"player_id":683953,"player":"Travis Bazzana","team":"CLE","avg":0.176,"hr":1,"rbi":1,"ops":0.616,"obp":0.263,"slg":0.353,"games":5,"pa":19,"sb":0,"window":"7-day"},{"rank":10,"player_id":608070,"player":"Jos\u00e9 Ram\u00edrez","team":"CLE","avg":0.222,"hr":0,"rbi":0,"ops":0.556,"obp":0.333,"slg":0.222,"games":5,"pa":21,"sb":2,"window":"7-day"}],"cold_hitters":[{"rank":1,"player_id":683748,"player":"Victor Mesa Jr.","team":"TB","avg":0.1,"hr":0,"rbi":0,"ops":0.282,"obp":0.182,"slg":0.1,"games":6,"pa":22,"sb":1,"window":"7-day"},{"rank":2,"player_id":666176,"player":"Jo Adell","team":"CLE","avg":0.118,"hr":0,"rbi":0,"ops":0.387,"obp":0.211,"slg":0.176,"games":5,"pa":19,"sb":0,"window":"7-day"},{"rank":3,"player_id":676356,"player":"Jonny DeLuca","team":"TB","avg":0.1,"hr":0,"rbi":2,"ops":0.236,"obp":0.136,"slg":0.1,"games":6,"pa":22,"sb":0,"window":"7-day"},{"rank":4,"player_id":672275,"player":"Patrick Bailey","team":"CLE","avg":0.143,"hr":0,"rbi":1,"ops":0.393,"obp":0.25,"slg":0.143,"games":5,"pa":16,"sb":0,"window":"7-day"},{"rank":5,"player_id":670764,"player":"Taylor Walls","team":"TB","avg":0.188,"hr":0,"rbi":0,"ops":0.487,"obp":0.3,"slg":0.188,"games":6,"pa":20,"sb":2,"window":"7-day"},{"rank":6,"player_id":677587,"player":"Brayan Rocchio","team":"CLE","avg":0.176,"hr":0,"rbi":1,"ops":0.353,"obp":0.176,"slg":0.176,"games":5,"pa":17,"sb":0,"window":"7-day"}],"hot_pitchers":[{"rank":1,"player_id":641329,"player":"Bryan Baker","team":"TB","era":0.0,"ip":2.0,"k":1,"role":"closer","appearances":2,"gs":null,"sv":2,"bs":0,"sv_pct":1.0,"whip":null,"k9":null,"window":"7-day"},{"rank":2,"player_id":656730,"player":"Trevor Megill","team":"MIL","era":3.86,"ip":2.3,"k":3,"role":"closer","appearances":2,"gs":null,"sv":2,"bs":0,"sv_pct":1.0,"whip":null,"k9":null,"window":"7-day"},{"rank":3,"player_id":656876,"player":"Drew Rasmussen","team":"TB","era":1.29,"ip":7.0,"k":6,"role":"starter","appearances":null,"gs":1,"sv":null,"bs":null,"sv_pct":null,"whip":0.71,"k9":7.7,"window":"7-day"},{"rank":4,"player_id":642547,"player":"Freddy Peralta","team":"TB","era":0.79,"ip":11.3,"k":9,"role":"starter","appearances":null,"gs":2,"sv":null,"bs":null,"sv_pct":null,"whip":1.24,"k9":7.1,"window":"7-day"},{"rank":5,"player_id":607259,"player":"Nick Martinez","team":"TB","era":2.61,"ip":10.3,"k":8,"role":"starter","appearances":null,"gs":2,"sv":null,"bs":null,"sv_pct":null,"whip":0.87,"k9":7.0,"window":"7-day"},{"rank":6,"player_id":800048,"player":"Parker Messick","team":"CLE","era":2.57,"ip":7.0,"k":6,"role":"starter","appearances":null,"gs":2,"sv":null,"bs":null,"sv_pct":null,"whip":2.14,"k9":7.7,"window":"7-day"}],"cold_pitchers":[],"breakout_hitters":[{"rank":1,"player_id":650490,"player":"Yandy D\u00edaz","team":"TB","avg":0.282,"hr":2,"rbi":4,"ops":0.831,"obp":0.293,"slg":0.538,"games":9,"pa":41,"sb":0,"window":"15-day"},{"rank":2,"player_id":802415,"player":"Chandler Simpson","team":"TB","avg":0.32,"hr":0,"rbi":4,"ops":0.761,"obp":0.321,"slg":0.44,"games":8,"pa":28,"sb":4,"window":"15-day"},{"rank":3,"player_id":666018,"player":"Jonathan Aranda","team":"TB","avg":0.324,"hr":0,"rbi":4,"ops":0.649,"obp":0.325,"slg":0.324,"games":9,"pa":40,"sb":0,"window":"15-day"},{"rank":4,"player_id":691406,"player":"Junior Caminero","team":"TB","avg":0.294,"hr":1,"rbi":4,"ops":0.851,"obp":0.351,"slg":0.5,"games":9,"pa":37,"sb":0,"window":"15-day"},{"rank":5,"player_id":800050,"player":"Chase DeLauter","team":"CLE","avg":0.342,"hr":1,"rbi":6,"ops":0.932,"obp":0.432,"slg":0.5,"games":10,"pa":44,"sb":0,"window":"15-day"},{"rank":6,"player_id":663993,"player":"Nathaniel Lowe","team":"CLE","avg":0.229,"hr":0,"rbi":5,"ops":0.582,"obp":0.325,"slg":0.257,"games":10,"pa":40,"sb":0,"window":"15-day"},{"rank":7,"player_id":608070,"player":"Jos\u00e9 Ram\u00edrez","team":"CLE","avg":0.316,"hr":2,"rbi":8,"ops":0.962,"obp":0.409,"slg":0.553,"games":10,"pa":44,"sb":3,"window":"15-day"}],"breakout_pitchers":[{"rank":1,"player_id":641329,"player":"Bryan Baker","team":"TB","era":0.0,"ip":4.0,"k":3,"role":"closer","appearances":4,"gs":null,"sv":4,"bs":0,"sv_pct":1.0,"whip":null,"k9":null,"window":"15-day"},{"rank":2,"player_id":656730,"player":"Trevor Megill","team":"MIL","era":2.08,"ip":4.3,"k":5,"role":"closer","appearances":4,"gs":null,"sv":4,"bs":0,"sv_pct":1.0,"whip":null,"k9":null,"window":"15-day"},{"rank":3,"player_id":656876,"player":"Drew Rasmussen","team":"TB","era":2.08,"ip":13.0,"k":13,"role":"starter","appearances":null,"gs":2,"sv":null,"bs":null,"sv_pct":null,"whip":1.0,"k9":9.0,"window":"15-day"}]}}