{"meta":{"date":"2026-06-12","generated_at":"2026-06-15T16:05:00Z","season":"2026"},"scores":[],"storylines":[],"tonight":[],"transactions":[],"leaderboards":{"hot_hitters":[],"cold_hitters":[],"hot_pitchers":[{"rank":1,"player_id":642207,"player":"Devin Williams","team":"NYM","era":0.0,"ip":2.3,"k":4,"role":"closer","appearances":2,"gs":null,"sv":2,"bs":0,"sv_pct":1.0,"whip":null,"k9":null,"window":"7-day"},{"rank":2,"player_id":694819,"player":"Jacob Misiorowski","team":"MIL","era":0.0,"ip":9.0,"k":15,"role":"starter","appearances":null,"gs":1,"sv":null,"bs":null,"sv_pct":null,"whip":0.11,"k9":15.0,"window":"7-day"},{"rank":3,"player_id":676440,"player":"Tanner Bibee","team":"CLE","era":2.57,"ip":7.0,"k":8,"role":"starter","appearances":null,"gs":1,"sv":null,"bs":null,"sv_pct":null,"whip":0.57,"k9":10.3,"window":"7-day"},{"rank":4,"player_id":682243,"player":"Bryce Miller","team":"SEA","era":2.25,"ip":8.0,"k":7,"role":"starter","appearances":null,"gs":1,"sv":null,"bs":null,"sv_pct":null,"whip":0.5,"k9":7.9,"window":"7-day"},{"rank":5,"player_id":645261,"player":"Sandy Alcantara","team":"MIA","era":3.38,"ip":8.0,"k":7,"role":"starter","appearances":null,"gs":1,"sv":null,"bs":null,"sv_pct":null,"whip":0.75,"k9":7.9,"window":"7-day"},{"rank":6,"player_id":608379,"player":"Michael Wacha","team":"KC","era":5.14,"ip":7.0,"k":2,"role":"starter","appearances":null,"gs":1,"sv":null,"bs":null,"sv_pct":null,"whip":1.43,"k9":2.6,"window":"7-day"}],"cold_pitchers":[],"breakout_hitters":[],"breakout_pitchers":[{"rank":1,"player_id":642207,"player":"Devin Williams","team":"NYM","era":0.0,"ip":2.3,"k":4,"role":"closer","appearances":2,"gs":null,"sv":2,"bs":0,"sv_pct":1.0,"whip":null,"k9":null,"window":"15-day"},{"rank":2,"player_id":694819,"player":"Jacob Misiorowski","team":"MIL","era":0.0,"ip":9.0,"k":15,"role":"starter","appearances":null,"gs":1,"sv":null,"bs":null,"sv_pct":null,"whip":0.11,"k9":15.0,"window":"15-day"},{"rank":3,"player_id":676440,"player":"Tanner Bibee","team":"CLE","era":2.57,"ip":7.0,"k":8,"role":"starter","appearances":null,"gs":1,"sv":null,"bs":null,"sv_pct":null,"whip":0.57,"k9":10.3,"window":"15-day"}]}}