{"meta":{"date":"2026-10-14","generated_at":"2026-10-15T14:18:25.590537+00:00","season":"2026"},"scores":[{"away":"MIL","away_score":6,"home":"LAD","home_score":2,"final":true,"tag":"Comeback"}],"storylines":[{"matchup":"MIL @ LAD","score":"6-2","tag":"Comeback","body":"The Milwaukee Brewers rallied past the Los Angeles Dodgers 6-2 behind a decisive seventh inning explosion led by Jake Bauers, whose two-run homer proved to be the game-winning blow and his 26th of the season. Garrett Mitchell added another fly ball homer in the same inning as the Brewers erased a deficit, with DL Hall earning the win and Trevor Megill notching the save over Blake Snell. The Dodgers had threatened earlier when Will Smith doubled in the sixth to drive in two runs, but it proved insufficient against Milwaukee's late surge."}],"tonight":[{"matchup":"TB @ CLE","broadcast":"TBS/HBO MAX","note":"The Tampa Bay Rays and Cleveland Guardians, each sitting at 1-1, face off in a nationally televised matchup with Griffin Jax taking the mound for Tampa Bay against Cleveland's Gavin Williams. The game will be broadcast across multiple platforms including TBS/HBO MAX, TruTV, and ESPN Radio, giving fans numerous ways to catch this evenly matched postseason series."}],"transactions":[],"leaderboards":{"hot_hitters":[{"rank":1,"player_id":608070,"player":"Jos\u00e9 Ram\u00edrez","team":"CLE","avg":0.429,"hr":2,"rbi":8,"ops":1.335,"obp":0.478,"slg":0.857,"games":5,"pa":23,"sb":2,"window":"7-day"},{"rank":2,"player_id":672275,"player":"Patrick Bailey","team":"CLE","avg":0.4,"hr":2,"rbi":3,"ops":1.271,"obp":0.471,"slg":0.8,"games":5,"pa":17,"sb":0,"window":"7-day"},{"rank":3,"player_id":800050,"player":"Chase DeLauter","team":"CLE","avg":0.389,"hr":1,"rbi":4,"ops":1.188,"obp":0.522,"slg":0.667,"games":5,"pa":23,"sb":0,"window":"7-day"},{"rank":4,"player_id":661388,"player":"William Contreras","team":"MIL","avg":0.375,"hr":1,"rbi":3,"ops":1.007,"obp":0.444,"slg":0.562,"games":4,"pa":18,"sb":0,"window":"7-day"},{"rank":5,"player_id":641343,"player":"Jake Bauers","team":"MIL","avg":0.333,"hr":1,"rbi":3,"ops":1.113,"obp":0.529,"slg":0.583,"games":4,"pa":17,"sb":0,"window":"7-day"},{"rank":6,"player_id":668930,"player":"Brice Turang","team":"MIL","avg":0.357,"hr":1,"rbi":2,"ops":1.087,"obp":0.444,"slg":0.643,"games":4,"pa":18,"sb":0,"window":"7-day"},{"rank":7,"player_id":666176,"player":"Jo Adell","team":"CLE","avg":0.238,"hr":0,"rbi":7,"ops":0.685,"obp":0.304,"slg":0.381,"games":5,"pa":23,"sb":0,"window":"7-day"},{"rank":8,"player_id":806198,"player":"Cooper Pratt","team":"MIL","avg":0.429,"hr":0,"rbi":0,"ops":0.9,"obp":0.4,"slg":0.5,"games":4,"pa":15,"sb":1,"window":"7-day"},{"rank":9,"player_id":694192,"player":"Jackson Chourio","team":"MIL","avg":0.222,"hr":1,"rbi":2,"ops":0.652,"obp":0.263,"slg":0.389,"games":4,"pa":19,"sb":0,"window":"7-day"},{"rank":10,"player_id":669003,"player":"Garrett Mitchell","team":"MIL","avg":0.214,"hr":1,"rbi":2,"ops":0.924,"obp":0.353,"slg":0.571,"games":4,"pa":17,"sb":0,"window":"7-day"}],"cold_hitters":[{"rank":1,"player_id":518692,"player":"Freddie Freeman","team":"LAD","avg":0.067,"hr":0,"rbi":1,"ops":0.129,"obp":0.062,"slg":0.067,"games":4,"pa":16,"sb":0,"window":"7-day"},{"rank":2,"player_id":669257,"player":"Will Smith","team":"LAD","avg":0.067,"hr":0,"rbi":2,"ops":0.258,"obp":0.125,"slg":0.133,"games":4,"pa":16,"sb":0,"window":"7-day"},{"rank":3,"player_id":677587,"player":"Brayan Rocchio","team":"CLE","avg":0.118,"hr":0,"rbi":1,"ops":0.318,"obp":0.2,"slg":0.118,"games":5,"pa":20,"sb":1,"window":"7-day"},{"rank":4,"player_id":660271,"player":"Shohei Ohtani","team":"LAD","avg":0.167,"hr":0,"rbi":0,"ops":0.479,"obp":0.312,"slg":0.167,"games":4,"pa":16,"sb":1,"window":"7-day"},{"rank":5,"player_id":605141,"player":"Mookie Betts","team":"LAD","avg":0.188,"hr":0,"rbi":0,"ops":0.465,"obp":0.278,"slg":0.188,"games":4,"pa":18,"sb":0,"window":"7-day"},{"rank":6,"player_id":683953,"player":"Travis Bazzana","team":"CLE","avg":0.176,"hr":0,"rbi":1,"ops":0.498,"obp":0.263,"slg":0.235,"games":5,"pa":19,"sb":1,"window":"7-day"},{"rank":7,"player_id":606192,"player":"Teoscar Hern\u00e1ndez","team":"LAD","avg":0.214,"hr":0,"rbi":1,"ops":0.464,"obp":0.25,"slg":0.214,"games":4,"pa":16,"sb":0,"window":"7-day"},{"rank":8,"player_id":663656,"player":"Kyle Tucker","team":"LAD","avg":0.273,"hr":0,"rbi":0,"ops":0.83,"obp":0.467,"slg":0.364,"games":4,"pa":15,"sb":0,"window":"7-day"},{"rank":9,"player_id":663993,"player":"Nathaniel Lowe","team":"CLE","avg":0.222,"hr":0,"rbi":2,"ops":0.586,"obp":0.364,"slg":0.222,"games":5,"pa":22,"sb":0,"window":"7-day"},{"rank":10,"player_id":680757,"player":"Steven Kwan","team":"CLE","avg":0.273,"hr":0,"rbi":1,"ops":0.633,"obp":0.36,"slg":0.273,"games":5,"pa":25,"sb":0,"window":"7-day"}],"hot_pitchers":[{"rank":1,"player_id":641329,"player":"Bryan Baker","team":"TB","era":0.0,"ip":2.0,"k":3,"role":"closer","appearances":2,"gs":null,"sv":2,"bs":0,"sv_pct":1.0,"whip":null,"k9":null,"window":"7-day"},{"rank":2,"player_id":656730,"player":"Trevor Megill","team":"MIL","era":0.0,"ip":3.3,"k":4,"role":"closer","appearances":3,"gs":null,"sv":3,"bs":0,"sv_pct":1.0,"whip":null,"k9":null,"window":"7-day"},{"rank":3,"player_id":688107,"player":"Robert Gasser","team":"MIL","era":1.0,"ip":9.0,"k":6,"role":"starter","appearances":null,"gs":2,"sv":null,"bs":null,"sv_pct":null,"whip":0.89,"k9":6.0,"window":"7-day"},{"rank":4,"player_id":800048,"player":"Parker Messick","team":"CLE","era":2.45,"ip":7.3,"k":8,"role":"starter","appearances":null,"gs":2,"sv":null,"bs":null,"sv_pct":null,"whip":1.91,"k9":9.8,"window":"7-day"}],"cold_pitchers":[],"breakout_hitters":[{"rank":1,"player_id":608070,"player":"Jos\u00e9 Ram\u00edrez","team":"CLE","avg":0.333,"hr":2,"rbi":8,"ops":1.086,"obp":0.419,"slg":0.667,"games":7,"pa":31,"sb":2,"window":"15-day"},{"rank":2,"player_id":672275,"player":"Patrick Bailey","team":"CLE","avg":0.318,"hr":2,"rbi":3,"ops":0.966,"obp":0.375,"slg":0.591,"games":8,"pa":24,"sb":0,"window":"15-day"},{"rank":3,"player_id":800050,"player":"Chase DeLauter","team":"CLE","avg":0.346,"hr":1,"rbi":4,"ops":0.99,"obp":0.452,"slg":0.538,"games":7,"pa":31,"sb":0,"window":"15-day"},{"rank":4,"player_id":661388,"player":"William Contreras","team":"MIL","avg":0.37,"hr":3,"rbi":5,"ops":1.155,"obp":0.452,"slg":0.704,"games":7,"pa":31,"sb":0,"window":"15-day"},{"rank":5,"player_id":641343,"player":"Jake Bauers","team":"MIL","avg":0.259,"hr":1,"rbi":3,"ops":0.753,"obp":0.382,"slg":0.37,"games":8,"pa":34,"sb":0,"window":"15-day"},{"rank":6,"player_id":668930,"player":"Brice Turang","team":"MIL","avg":0.241,"hr":1,"rbi":3,"ops":0.722,"obp":0.343,"slg":0.379,"games":8,"pa":35,"sb":1,"window":"15-day"},{"rank":7,"player_id":666176,"player":"Jo Adell","team":"CLE","avg":0.258,"hr":1,"rbi":9,"ops":0.859,"obp":0.343,"slg":0.516,"games":8,"pa":35,"sb":0,"window":"15-day"},{"rank":8,"player_id":694192,"player":"Jackson Chourio","team":"MIL","avg":0.265,"hr":2,"rbi":9,"ops":0.711,"obp":0.27,"slg":0.441,"games":8,"pa":37,"sb":0,"window":"15-day"}],"breakout_pitchers":[{"rank":1,"player_id":641329,"player":"Bryan Baker","team":"TB","era":0.0,"ip":4.0,"k":5,"role":"closer","appearances":4,"gs":null,"sv":4,"bs":0,"sv_pct":1.0,"whip":null,"k9":null,"window":"15-day"},{"rank":2,"player_id":656730,"player":"Trevor Megill","team":"MIL","era":0.0,"ip":4.7,"k":6,"role":"closer","appearances":4,"gs":null,"sv":4,"bs":0,"sv_pct":1.0,"whip":null,"k9":null,"window":"15-day"}]}}