{"meta":{"date":"2026-10-28","generated_at":"2026-10-29T16:21:10.810640+00:00","season":"2026"},"scores":[{"away":"MIL","away_score":4,"home":"TB","home_score":1,"final":true,"tag":null}],"storylines":[{"matchup":"MIL @ TB","score":"4-1","tag":null,"body":"Milwaukee Brewers 4, Tampa Bay Rays 1. Jacob Misiorowski earned the win. Key moment: William Contreras doubles (2) on a fly ball to left fielder Chandler Simpson. Christian Yelich scores.."}],"tonight":[],"transactions":[],"leaderboards":{"hot_hitters":[{"rank":1,"player_id":806198,"player":"Cooper Pratt","team":"MIL","avg":0.421,"hr":1,"rbi":7,"ops":1.139,"obp":0.455,"slg":0.684,"games":5,"pa":22,"sb":1,"window":"7-day"},{"rank":2,"player_id":689414,"player":"Liam Hicks","team":"TB","avg":0.333,"hr":1,"rbi":5,"ops":0.884,"obp":0.36,"slg":0.524,"games":6,"pa":25,"sb":0,"window":"7-day"},{"rank":3,"player_id":694192,"player":"Jackson Chourio","team":"MIL","avg":0.458,"hr":0,"rbi":2,"ops":1.0,"obp":0.458,"slg":0.542,"games":5,"pa":24,"sb":3,"window":"7-day"},{"rank":4,"player_id":661388,"player":"William Contreras","team":"MIL","avg":0.381,"hr":0,"rbi":4,"ops":0.863,"obp":0.435,"slg":0.429,"games":5,"pa":23,"sb":1,"window":"7-day"},{"rank":5,"player_id":802415,"player":"Chandler Simpson","team":"TB","avg":0.407,"hr":0,"rbi":3,"ops":0.911,"obp":0.393,"slg":0.519,"games":7,"pa":28,"sb":4,"window":"7-day"},{"rank":6,"player_id":666152,"player":"David Hamilton","team":"MIL","avg":0.25,"hr":1,"rbi":4,"ops":0.735,"obp":0.235,"slg":0.5,"games":5,"pa":17,"sb":0,"window":"7-day"},{"rank":7,"player_id":691406,"player":"Junior Caminero","team":"TB","avg":0.269,"hr":1,"rbi":3,"ops":0.745,"obp":0.321,"slg":0.423,"games":7,"pa":28,"sb":0,"window":"7-day"},{"rank":8,"player_id":650490,"player":"Yandy D\u00edaz","team":"TB","avg":0.241,"hr":1,"rbi":3,"ops":0.695,"obp":0.281,"slg":0.414,"games":7,"pa":32,"sb":0,"window":"7-day"},{"rank":9,"player_id":686217,"player":"Sal Frelick","team":"MIL","avg":0.263,"hr":1,"rbi":2,"ops":0.712,"obp":0.238,"slg":0.474,"games":5,"pa":21,"sb":1,"window":"7-day"},{"rank":10,"player_id":668930,"player":"Brice Turang","team":"MIL","avg":0.316,"hr":0,"rbi":2,"ops":0.908,"obp":0.435,"slg":0.474,"games":5,"pa":23,"sb":1,"window":"7-day"}],"cold_hitters":[{"rank":1,"player_id":670764,"player":"Taylor Walls","team":"TB","avg":0.059,"hr":0,"rbi":0,"ops":0.286,"obp":0.227,"slg":0.059,"games":7,"pa":22,"sb":2,"window":"7-day"},{"rank":2,"player_id":641343,"player":"Jake Bauers","team":"MIL","avg":0.095,"hr":0,"rbi":0,"ops":0.304,"obp":0.208,"slg":0.095,"games":5,"pa":24,"sb":0,"window":"7-day"},{"rank":3,"player_id":683748,"player":"Victor Mesa Jr.","team":"TB","avg":0.111,"hr":0,"rbi":0,"ops":0.349,"obp":0.238,"slg":0.111,"games":7,"pa":21,"sb":1,"window":"7-day"},{"rank":4,"player_id":676356,"player":"Jonny DeLuca","team":"TB","avg":0.115,"hr":0,"rbi":3,"ops":0.297,"obp":0.143,"slg":0.154,"games":7,"pa":28,"sb":0,"window":"7-day"},{"rank":5,"player_id":669003,"player":"Garrett Mitchell","team":"MIL","avg":0.158,"hr":0,"rbi":2,"ops":0.396,"obp":0.238,"slg":0.158,"games":5,"pa":21,"sb":0,"window":"7-day"},{"rank":6,"player_id":666018,"player":"Jonathan Aranda","team":"TB","avg":0.222,"hr":0,"rbi":1,"ops":0.501,"obp":0.241,"slg":0.259,"games":7,"pa":29,"sb":0,"window":"7-day"},{"rank":7,"player_id":592885,"player":"Christian Yelich","team":"MIL","avg":0.235,"hr":0,"rbi":2,"ops":0.717,"obp":0.364,"slg":0.353,"games":5,"pa":22,"sb":2,"window":"7-day"}],"hot_pitchers":[{"rank":1,"player_id":694819,"player":"Jacob Misiorowski","team":"MIL","era":0.84,"ip":10.7,"k":5,"role":"starter","appearances":null,"gs":2,"sv":null,"bs":null,"sv_pct":null,"whip":0.75,"k9":4.2,"window":"7-day"},{"rank":2,"player_id":656876,"player":"Drew Rasmussen","team":"TB","era":3.07,"ip":14.7,"k":14,"role":"starter","appearances":null,"gs":3,"sv":null,"bs":null,"sv_pct":null,"whip":1.02,"k9":8.6,"window":"7-day"},{"rank":3,"player_id":642547,"player":"Freddy Peralta","team":"TB","era":5.4,"ip":10.0,"k":7,"role":"starter","appearances":null,"gs":2,"sv":null,"bs":null,"sv_pct":null,"whip":1.8,"k9":6.3,"window":"7-day"}],"cold_pitchers":[],"breakout_hitters":[{"rank":1,"player_id":806198,"player":"Cooper Pratt","team":"MIL","avg":0.394,"hr":1,"rbi":7,"ops":0.951,"obp":0.405,"slg":0.545,"games":9,"pa":37,"sb":2,"window":"15-day"},{"rank":2,"player_id":689414,"player":"Liam Hicks","team":"TB","avg":0.29,"hr":1,"rbi":7,"ops":0.734,"obp":0.314,"slg":0.419,"games":10,"pa":35,"sb":0,"window":"15-day"},{"rank":3,"player_id":694192,"player":"Jackson Chourio","team":"MIL","avg":0.326,"hr":1,"rbi":3,"ops":0.767,"obp":0.326,"slg":0.442,"games":9,"pa":43,"sb":3,"window":"15-day"},{"rank":4,"player_id":661388,"player":"William Contreras","team":"MIL","avg":0.371,"hr":1,"rbi":7,"ops":0.964,"obp":0.45,"slg":0.514,"games":9,"pa":40,"sb":1,"window":"15-day"},{"rank":5,"player_id":802415,"player":"Chandler Simpson","team":"TB","avg":0.351,"hr":0,"rbi":6,"ops":0.836,"obp":0.35,"slg":0.486,"games":11,"pa":40,"sb":4,"window":"15-day"},{"rank":6,"player_id":666152,"player":"David Hamilton","team":"MIL","avg":0.348,"hr":2,"rbi":6,"ops":0.972,"obp":0.32,"slg":0.652,"games":7,"pa":25,"sb":3,"window":"15-day"},{"rank":7,"player_id":691406,"player":"Junior Caminero","team":"TB","avg":0.238,"hr":1,"rbi":5,"ops":0.67,"obp":0.289,"slg":0.381,"games":11,"pa":45,"sb":0,"window":"15-day"},{"rank":8,"player_id":650490,"player":"Yandy D\u00edaz","team":"TB","avg":0.255,"hr":2,"rbi":5,"ops":0.769,"obp":0.28,"slg":0.489,"games":11,"pa":50,"sb":0,"window":"15-day"},{"rank":9,"player_id":668930,"player":"Brice Turang","team":"MIL","avg":0.333,"hr":1,"rbi":4,"ops":1.042,"obp":0.475,"slg":0.567,"games":9,"pa":40,"sb":1,"window":"15-day"}],"breakout_pitchers":[{"rank":1,"player_id":694819,"player":"Jacob Misiorowski","team":"MIL","era":1.2,"ip":15.0,"k":10,"role":"starter","appearances":null,"gs":3,"sv":null,"bs":null,"sv_pct":null,"whip":1.07,"k9":6.0,"window":"15-day"}]}}