{"meta":{"date":"2026-10-19","generated_at":"2026-10-20T14:25:58.046515+00:00","season":"2026"},"scores":[{"away":"CLE","away_score":3,"home":"TB","home_score":7,"final":true,"tag":null}],"storylines":[{"matchup":"CLE @ TB","score":"3-7","tag":null,"body":"Cleveland Guardians 3, Tampa Bay Rays 7. Freddy Peralta earned the win. Key moment: Richie Palacios doubles (3) on a fly ball to right fielder Chase DeLauter. Chandler Simpson scores. Victor Mesa Jr. scores.."}],"tonight":[],"transactions":[],"leaderboards":{"hot_hitters":[{"rank":1,"player_id":650490,"player":"Yandy D\u00edaz","team":"TB","avg":0.333,"hr":2,"rbi":4,"ops":1.025,"obp":0.321,"slg":0.704,"games":6,"pa":28,"sb":0,"window":"7-day"},{"rank":2,"player_id":800050,"player":"Chase DeLauter","team":"CLE","avg":0.364,"hr":1,"rbi":4,"ops":1.098,"obp":0.462,"slg":0.636,"games":6,"pa":26,"sb":0,"window":"7-day"},{"rank":3,"player_id":691406,"player":"Junior Caminero","team":"TB","avg":0.261,"hr":1,"rbi":4,"ops":0.798,"obp":0.32,"slg":0.478,"games":6,"pa":25,"sb":0,"window":"7-day"},{"rank":4,"player_id":663993,"player":"Nathaniel Lowe","team":"CLE","avg":0.273,"hr":0,"rbi":4,"ops":0.623,"obp":0.304,"slg":0.318,"games":6,"pa":23,"sb":0,"window":"7-day"},{"rank":5,"player_id":802415,"player":"Chandler Simpson","team":"TB","avg":0.294,"hr":0,"rbi":3,"ops":0.771,"obp":0.3,"slg":0.471,"games":6,"pa":20,"sb":2,"window":"7-day"},{"rank":6,"player_id":689414,"player":"Liam Hicks","team":"TB","avg":0.294,"hr":0,"rbi":3,"ops":0.663,"obp":0.368,"slg":0.294,"games":6,"pa":19,"sb":0,"window":"7-day"},{"rank":7,"player_id":672275,"player":"Patrick Bailey","team":"CLE","avg":0.222,"hr":1,"rbi":2,"ops":0.689,"obp":0.3,"slg":0.389,"games":6,"pa":20,"sb":0,"window":"7-day"},{"rank":8,"player_id":608070,"player":"Jos\u00e9 Ram\u00edrez","team":"CLE","avg":0.304,"hr":0,"rbi":1,"ops":0.689,"obp":0.385,"slg":0.304,"games":6,"pa":26,"sb":2,"window":"7-day"},{"rank":9,"player_id":666018,"player":"Jonathan Aranda","team":"TB","avg":0.217,"hr":0,"rbi":3,"ops":0.44,"obp":0.222,"slg":0.217,"games":6,"pa":27,"sb":0,"window":"7-day"},{"rank":10,"player_id":683953,"player":"Travis Bazzana","team":"CLE","avg":0.19,"hr":1,"rbi":1,"ops":0.594,"obp":0.261,"slg":0.333,"games":6,"pa":23,"sb":1,"window":"7-day"}],"cold_hitters":[{"rank":1,"player_id":683748,"player":"Victor Mesa Jr.","team":"TB","avg":0.095,"hr":0,"rbi":0,"ops":0.269,"obp":0.174,"slg":0.095,"games":6,"pa":23,"sb":1,"window":"7-day"},{"rank":2,"player_id":694192,"player":"Jackson Chourio","team":"MIL","avg":0.067,"hr":1,"rbi":1,"ops":0.333,"obp":0.067,"slg":0.267,"games":3,"pa":15,"sb":0,"window":"7-day"},{"rank":3,"player_id":677587,"player":"Brayan Rocchio","team":"CLE","avg":0.143,"hr":0,"rbi":1,"ops":0.286,"obp":0.143,"slg":0.143,"games":6,"pa":21,"sb":0,"window":"7-day"},{"rank":4,"player_id":670764,"player":"Taylor Walls","team":"TB","avg":0.176,"hr":0,"rbi":0,"ops":0.462,"obp":0.286,"slg":0.176,"games":6,"pa":21,"sb":2,"window":"7-day"},{"rank":5,"player_id":666176,"player":"Jo Adell","team":"CLE","avg":0.136,"hr":0,"rbi":2,"ops":0.436,"obp":0.208,"slg":0.227,"games":6,"pa":24,"sb":0,"window":"7-day"},{"rank":6,"player_id":680757,"player":"Steven Kwan","team":"CLE","avg":0.269,"hr":0,"rbi":0,"ops":0.566,"obp":0.296,"slg":0.269,"games":6,"pa":27,"sb":0,"window":"7-day"},{"rank":7,"player_id":676356,"player":"Jonny DeLuca","team":"TB","avg":0.2,"hr":0,"rbi":3,"ops":0.427,"obp":0.227,"slg":0.2,"games":6,"pa":22,"sb":1,"window":"7-day"}],"hot_pitchers":[{"rank":1,"player_id":676879,"player":"Aaron Ashby","team":"MIL","era":0.0,"ip":4.7,"k":5,"role":"closer","appearances":2,"gs":null,"sv":2,"bs":0,"sv_pct":1.0,"whip":null,"k9":null,"window":"7-day"},{"rank":2,"player_id":641329,"player":"Bryan Baker","team":"TB","era":0.0,"ip":2.0,"k":1,"role":"closer","appearances":2,"gs":null,"sv":2,"bs":0,"sv_pct":1.0,"whip":null,"k9":null,"window":"7-day"},{"rank":3,"player_id":642547,"player":"Freddy Peralta","team":"TB","era":0.79,"ip":11.3,"k":9,"role":"starter","appearances":null,"gs":2,"sv":null,"bs":null,"sv_pct":null,"whip":1.24,"k9":7.1,"window":"7-day"},{"rank":4,"player_id":656876,"player":"Drew Rasmussen","team":"TB","era":2.08,"ip":13.0,"k":13,"role":"starter","appearances":null,"gs":2,"sv":null,"bs":null,"sv_pct":null,"whip":1.0,"k9":9.0,"window":"7-day"},{"rank":5,"player_id":800048,"player":"Parker Messick","team":"CLE","era":2.57,"ip":7.0,"k":6,"role":"starter","appearances":null,"gs":2,"sv":null,"bs":null,"sv_pct":null,"whip":2.14,"k9":7.7,"window":"7-day"}],"cold_pitchers":[],"breakout_hitters":[{"rank":1,"player_id":650490,"player":"Yandy D\u00edaz","team":"TB","avg":0.308,"hr":2,"rbi":4,"ops":0.881,"obp":0.317,"slg":0.564,"games":9,"pa":41,"sb":0,"window":"15-day"},{"rank":2,"player_id":800050,"player":"Chase DeLauter","team":"CLE","avg":0.31,"hr":1,"rbi":6,"ops":0.848,"obp":0.396,"slg":0.452,"games":11,"pa":48,"sb":0,"window":"15-day"},{"rank":3,"player_id":691406,"player":"Junior Caminero","team":"TB","avg":0.273,"hr":1,"rbi":4,"ops":0.806,"obp":0.351,"slg":0.455,"games":9,"pa":37,"sb":0,"window":"15-day"},{"rank":4,"player_id":663993,"player":"Nathaniel Lowe","team":"CLE","avg":0.243,"hr":0,"rbi":5,"ops":0.646,"obp":0.349,"slg":0.297,"games":11,"pa":43,"sb":0,"window":"15-day"},{"rank":5,"player_id":802415,"player":"Chandler Simpson","team":"TB","avg":0.24,"hr":0,"rbi":4,"ops":0.61,"obp":0.25,"slg":0.36,"games":8,"pa":28,"sb":3,"window":"15-day"},{"rank":6,"player_id":689414,"player":"Liam Hicks","team":"TB","avg":0.222,"hr":0,"rbi":4,"ops":0.55,"obp":0.29,"slg":0.259,"games":9,"pa":31,"sb":0,"window":"15-day"},{"rank":7,"player_id":672275,"player":"Patrick Bailey","team":"CLE","avg":0.273,"hr":2,"rbi":4,"ops":0.788,"obp":0.333,"slg":0.455,"games":11,"pa":36,"sb":0,"window":"15-day"},{"rank":8,"player_id":608070,"player":"Jos\u00e9 Ram\u00edrez","team":"CLE","avg":0.293,"hr":2,"rbi":8,"ops":0.908,"obp":0.396,"slg":0.512,"games":11,"pa":48,"sb":3,"window":"15-day"},{"rank":9,"player_id":666018,"player":"Jonathan Aranda","team":"TB","avg":0.257,"hr":1,"rbi":5,"ops":0.593,"obp":0.25,"slg":0.343,"games":9,"pa":40,"sb":0,"window":"15-day"}],"breakout_pitchers":[{"rank":1,"player_id":676879,"player":"Aaron Ashby","team":"MIL","era":0.0,"ip":6.7,"k":6,"role":"closer","appearances":3,"gs":null,"sv":2,"bs":0,"sv_pct":1.0,"whip":null,"k9":null,"window":"15-day"},{"rank":2,"player_id":641329,"player":"Bryan Baker","team":"TB","era":0.0,"ip":5.0,"k":5,"role":"closer","appearances":5,"gs":null,"sv":5,"bs":0,"sv_pct":1.0,"whip":null,"k9":null,"window":"15-day"},{"rank":3,"player_id":656876,"player":"Drew Rasmussen","team":"TB","era":1.29,"ip":21.0,"k":23,"role":"starter","appearances":null,"gs":3,"sv":null,"bs":null,"sv_pct":null,"whip":0.76,"k9":9.9,"window":"15-day"}]}}