{"meta":{"date":"2026-10-13","generated_at":"2026-10-14T14:36:45.633433+00:00","season":"2026"},"scores":[{"away":"CLE","away_score":1,"home":"TB","home_score":3,"final":true,"tag":null}],"storylines":[{"matchup":"CLE @ TB","score":"1-3","tag":null,"body":"Cleveland Guardians 1, Tampa Bay Rays 3. Freddy Peralta earned the win. Key moment: Liam Hicks singles on a line drive to center fielder Petey Halpin. Chandler Simpson scores. Ben Williamson scores.."}],"tonight":[{"matchup":"MIL @ LAD","broadcast":"FS1 / FOX ONE","note":"Milwaukee Brewers at Los Angeles Dodgers. Robert Gasser vs Blake Snell. National broadcast on FS1 / FOX ONE."}],"transactions":[],"leaderboards":{"hot_hitters":[{"rank":1,"player_id":608070,"player":"Jos\u00e9 Ram\u00edrez","team":"CLE","avg":0.429,"hr":2,"rbi":8,"ops":1.335,"obp":0.478,"slg":0.857,"games":5,"pa":23,"sb":2,"window":"7-day"},{"rank":2,"player_id":661388,"player":"William Contreras","team":"MIL","avg":0.5,"hr":2,"rbi":4,"ops":1.454,"obp":0.579,"slg":0.875,"games":4,"pa":19,"sb":0,"window":"7-day"},{"rank":3,"player_id":672275,"player":"Patrick Bailey","team":"CLE","avg":0.4,"hr":2,"rbi":3,"ops":1.271,"obp":0.471,"slg":0.8,"games":5,"pa":17,"sb":0,"window":"7-day"},{"rank":4,"player_id":800050,"player":"Chase DeLauter","team":"CLE","avg":0.389,"hr":1,"rbi":4,"ops":1.188,"obp":0.522,"slg":0.667,"games":5,"pa":23,"sb":0,"window":"7-day"},{"rank":5,"player_id":668930,"player":"Brice Turang","team":"MIL","avg":0.357,"hr":1,"rbi":2,"ops":1.117,"obp":0.474,"slg":0.643,"games":4,"pa":19,"sb":0,"window":"7-day"},{"rank":6,"player_id":592885,"player":"Christian Yelich","team":"MIL","avg":0.385,"hr":0,"rbi":3,"ops":0.785,"obp":0.4,"slg":0.385,"games":3,"pa":15,"sb":1,"window":"7-day"},{"rank":7,"player_id":666176,"player":"Jo Adell","team":"CLE","avg":0.238,"hr":0,"rbi":7,"ops":0.685,"obp":0.304,"slg":0.381,"games":5,"pa":23,"sb":0,"window":"7-day"},{"rank":8,"player_id":806198,"player":"Cooper Pratt","team":"MIL","avg":0.357,"hr":0,"rbi":0,"ops":0.762,"obp":0.333,"slg":0.429,"games":4,"pa":15,"sb":0,"window":"7-day"},{"rank":9,"player_id":680757,"player":"Steven Kwan","team":"CLE","avg":0.273,"hr":0,"rbi":1,"ops":0.633,"obp":0.36,"slg":0.273,"games":5,"pa":25,"sb":0,"window":"7-day"},{"rank":10,"player_id":663993,"player":"Nathaniel Lowe","team":"CLE","avg":0.222,"hr":0,"rbi":2,"ops":0.586,"obp":0.364,"slg":0.222,"games":5,"pa":22,"sb":0,"window":"7-day"}],"cold_hitters":[{"rank":1,"player_id":669257,"player":"Will Smith","team":"LAD","avg":0.067,"hr":0,"rbi":0,"ops":0.192,"obp":0.125,"slg":0.067,"games":4,"pa":16,"sb":0,"window":"7-day"},{"rank":2,"player_id":660271,"player":"Shohei Ohtani","team":"LAD","avg":0.083,"hr":0,"rbi":0,"ops":0.333,"obp":0.25,"slg":0.083,"games":4,"pa":16,"sb":1,"window":"7-day"},{"rank":3,"player_id":677587,"player":"Brayan Rocchio","team":"CLE","avg":0.118,"hr":0,"rbi":1,"ops":0.318,"obp":0.2,"slg":0.118,"games":5,"pa":20,"sb":1,"window":"7-day"},{"rank":4,"player_id":669003,"player":"Garrett Mitchell","team":"MIL","avg":0.133,"hr":0,"rbi":1,"ops":0.502,"obp":0.235,"slg":0.267,"games":4,"pa":17,"sb":0,"window":"7-day"},{"rank":5,"player_id":683953,"player":"Travis Bazzana","team":"CLE","avg":0.176,"hr":0,"rbi":1,"ops":0.498,"obp":0.263,"slg":0.235,"games":5,"pa":19,"sb":1,"window":"7-day"},{"rank":6,"player_id":606192,"player":"Teoscar Hern\u00e1ndez","team":"LAD","avg":0.2,"hr":0,"rbi":1,"ops":0.388,"obp":0.188,"slg":0.2,"games":4,"pa":16,"sb":0,"window":"7-day"},{"rank":7,"player_id":694192,"player":"Jackson Chourio","team":"MIL","avg":0.176,"hr":0,"rbi":2,"ops":0.387,"obp":0.211,"slg":0.176,"games":4,"pa":19,"sb":0,"window":"7-day"},{"rank":8,"player_id":663656,"player":"Kyle Tucker","team":"LAD","avg":0.25,"hr":0,"rbi":0,"ops":0.733,"obp":0.4,"slg":0.333,"games":4,"pa":15,"sb":1,"window":"7-day"},{"rank":9,"player_id":605141,"player":"Mookie Betts","team":"LAD","avg":0.25,"hr":0,"rbi":0,"ops":0.583,"obp":0.333,"slg":0.25,"games":4,"pa":18,"sb":0,"window":"7-day"},{"rank":10,"player_id":518692,"player":"Freddie Freeman","team":"LAD","avg":0.133,"hr":1,"rbi":2,"ops":0.51,"obp":0.176,"slg":0.333,"games":4,"pa":17,"sb":0,"window":"7-day"}],"hot_pitchers":[{"rank":1,"player_id":641329,"player":"Bryan Baker","team":"TB","era":0.0,"ip":2.0,"k":3,"role":"closer","appearances":2,"gs":null,"sv":2,"bs":0,"sv_pct":1.0,"whip":null,"k9":null,"window":"7-day"},{"rank":2,"player_id":656730,"player":"Trevor Megill","team":"MIL","era":0.0,"ip":2.0,"k":2,"role":"closer","appearances":2,"gs":null,"sv":2,"bs":0,"sv_pct":1.0,"whip":null,"k9":null,"window":"7-day"},{"rank":3,"player_id":621242,"player":"Edwin D\u00edaz","team":"LAD","era":0.0,"ip":2.0,"k":1,"role":"closer","appearances":2,"gs":null,"sv":2,"bs":0,"sv_pct":1.0,"whip":null,"k9":null,"window":"7-day"},{"rank":4,"player_id":808967,"player":"Yoshinobu Yamamoto","team":"LAD","era":3.72,"ip":9.7,"k":11,"role":"starter","appearances":null,"gs":2,"sv":null,"bs":null,"sv_pct":null,"whip":1.14,"k9":10.2,"window":"7-day"},{"rank":5,"player_id":800048,"player":"Parker Messick","team":"CLE","era":2.45,"ip":7.3,"k":8,"role":"starter","appearances":null,"gs":2,"sv":null,"bs":null,"sv_pct":null,"whip":1.91,"k9":9.8,"window":"7-day"}],"cold_pitchers":[],"breakout_hitters":[{"rank":1,"player_id":608070,"player":"Jos\u00e9 Ram\u00edrez","team":"CLE","avg":0.281,"hr":2,"rbi":8,"ops":0.924,"obp":0.361,"slg":0.562,"games":8,"pa":36,"sb":2,"window":"15-day"},{"rank":2,"player_id":661388,"player":"William Contreras","team":"MIL","avg":0.385,"hr":3,"rbi":5,"ops":1.215,"obp":0.484,"slg":0.731,"games":7,"pa":31,"sb":0,"window":"15-day"},{"rank":3,"player_id":672275,"player":"Patrick Bailey","team":"CLE","avg":0.333,"hr":4,"rbi":6,"ops":1.157,"obp":0.379,"slg":0.778,"games":9,"pa":29,"sb":0,"window":"15-day"},{"rank":4,"player_id":800050,"player":"Chase DeLauter","team":"CLE","avg":0.333,"hr":2,"rbi":5,"ops":1.044,"obp":0.444,"slg":0.6,"games":8,"pa":36,"sb":0,"window":"15-day"},{"rank":5,"player_id":668930,"player":"Brice Turang","team":"MIL","avg":0.25,"hr":2,"rbi":5,"ops":0.871,"obp":0.371,"slg":0.5,"games":8,"pa":35,"sb":1,"window":"15-day"},{"rank":6,"player_id":592885,"player":"Christian Yelich","team":"MIL","avg":0.32,"hr":0,"rbi":4,"ops":0.717,"obp":0.357,"slg":0.36,"games":7,"pa":28,"sb":2,"window":"15-day"},{"rank":7,"player_id":666176,"player":"Jo Adell","team":"CLE","avg":0.25,"hr":1,"rbi":9,"ops":0.797,"obp":0.325,"slg":0.472,"games":9,"pa":40,"sb":1,"window":"15-day"},{"rank":8,"player_id":663993,"player":"Nathaniel Lowe","team":"CLE","avg":0.226,"hr":0,"rbi":7,"ops":0.574,"obp":0.316,"slg":0.258,"games":9,"pa":38,"sb":0,"window":"15-day"}],"breakout_pitchers":[{"rank":1,"player_id":641329,"player":"Bryan Baker","team":"TB","era":0.0,"ip":4.0,"k":5,"role":"closer","appearances":4,"gs":null,"sv":4,"bs":0,"sv_pct":1.0,"whip":null,"k9":null,"window":"15-day"},{"rank":2,"player_id":656730,"player":"Trevor Megill","team":"MIL","era":0.0,"ip":3.3,"k":4,"role":"closer","appearances":3,"gs":null,"sv":3,"bs":0,"sv_pct":1.0,"whip":null,"k9":null,"window":"15-day"},{"rank":3,"player_id":621242,"player":"Edwin D\u00edaz","team":"LAD","era":0.0,"ip":2.0,"k":1,"role":"closer","appearances":2,"gs":null,"sv":2,"bs":0,"sv_pct":1.0,"whip":null,"k9":null,"window":"15-day"}]}}