{"meta":{"date":"2026-10-18","generated_at":"2026-10-19T16:35:51.277559+00:00","season":"2026"},"scores":[{"away":"TB","away_score":3,"home":"CLE","home_score":1,"final":true,"tag":null}],"storylines":[{"matchup":"TB @ CLE","score":"3-1","tag":null,"body":"The Tampa Bay Rays edged the Cleveland Guardians 3-1 behind Drew Rasmussen's pitching, with Bryan Baker earning the save. Chase DeLauter's walk in the bottom of the ninth inning proved decisive for Cleveland, though the Guardians fell just short despite the late-game opportunity."}],"tonight":[{"matchup":"CLE @ TB","broadcast":"TBS/HBO MAX","note":"The Cleveland Guardians, sitting at 2-3, travel to Tampa Bay to face the 3-2 Rays in a nationally televised matchup across TBS, HBO MAX, TruTV, and ESPN Radio. Shawn Armstrong takes the mound for Cleveland against Freddy Peralta in what shapes up as a key early-season showdown between two AL East contenders."}],"transactions":[],"leaderboards":{"hot_hitters":[{"rank":1,"player_id":800050,"player":"Chase DeLauter","team":"CLE","avg":0.353,"hr":1,"rbi":4,"ops":1.123,"obp":0.476,"slg":0.647,"games":5,"pa":21,"sb":0,"window":"7-day"},{"rank":2,"player_id":641343,"player":"Jake Bauers","team":"MIL","avg":0.286,"hr":1,"rbi":6,"ops":0.983,"obp":0.412,"slg":0.571,"games":4,"pa":17,"sb":0,"window":"7-day"},{"rank":3,"player_id":661388,"player":"William Contreras","team":"MIL","avg":0.357,"hr":1,"rbi":3,"ops":1.113,"obp":0.471,"slg":0.643,"games":4,"pa":17,"sb":0,"window":"7-day"},{"rank":4,"player_id":668930,"player":"Brice Turang","team":"MIL","avg":0.364,"hr":1,"rbi":2,"ops":1.257,"obp":0.529,"slg":0.727,"games":4,"pa":17,"sb":0,"window":"7-day"},{"rank":5,"player_id":650490,"player":"Yandy D\u00edaz","team":"TB","avg":0.348,"hr":1,"rbi":2,"ops":1.0,"obp":0.348,"slg":0.652,"games":5,"pa":23,"sb":0,"window":"7-day"},{"rank":6,"player_id":802415,"player":"Chandler Simpson","team":"TB","avg":0.308,"hr":0,"rbi":3,"ops":0.851,"obp":0.312,"slg":0.538,"games":5,"pa":16,"sb":1,"window":"7-day"},{"rank":7,"player_id":608070,"player":"Jos\u00e9 Ram\u00edrez","team":"CLE","avg":0.368,"hr":0,"rbi":1,"ops":0.797,"obp":0.429,"slg":0.368,"games":5,"pa":21,"sb":2,"window":"7-day"},{"rank":8,"player_id":660271,"player":"Shohei Ohtani","team":"LAD","avg":0.231,"hr":1,"rbi":3,"ops":0.774,"obp":0.312,"slg":0.462,"games":4,"pa":16,"sb":0,"window":"7-day"},{"rank":9,"player_id":672275,"player":"Patrick Bailey","team":"CLE","avg":0.267,"hr":1,"rbi":1,"ops":0.779,"obp":0.312,"slg":0.467,"games":5,"pa":16,"sb":0,"window":"7-day"},{"rank":10,"player_id":806198,"player":"Cooper Pratt","team":"MIL","avg":0.357,"hr":0,"rbi":0,"ops":0.69,"obp":0.333,"slg":0.357,"games":4,"pa":15,"sb":1,"window":"7-day"}],"cold_hitters":[{"rank":1,"player_id":518692,"player":"Freddie Freeman","team":"LAD","avg":0.071,"hr":0,"rbi":1,"ops":0.196,"obp":0.125,"slg":0.071,"games":4,"pa":16,"sb":0,"window":"7-day"},{"rank":2,"player_id":683748,"player":"Victor Mesa Jr.","team":"TB","avg":0.111,"hr":0,"rbi":0,"ops":0.269,"obp":0.158,"slg":0.111,"games":5,"pa":19,"sb":0,"window":"7-day"},{"rank":3,"player_id":677587,"player":"Brayan Rocchio","team":"CLE","avg":0.118,"hr":0,"rbi":1,"ops":0.235,"obp":0.118,"slg":0.118,"games":5,"pa":17,"sb":0,"window":"7-day"},{"rank":4,"player_id":666176,"player":"Jo Adell","team":"CLE","avg":0.111,"hr":0,"rbi":2,"ops":0.367,"obp":0.2,"slg":0.167,"games":5,"pa":20,"sb":0,"window":"7-day"},{"rank":5,"player_id":670764,"player":"Taylor Walls","team":"TB","avg":0.188,"hr":0,"rbi":0,"ops":0.364,"obp":0.176,"slg":0.188,"games":5,"pa":17,"sb":2,"window":"7-day"},{"rank":6,"player_id":669257,"player":"Will Smith","team":"LAD","avg":0.133,"hr":0,"rbi":2,"ops":0.454,"obp":0.188,"slg":0.267,"games":4,"pa":16,"sb":0,"window":"7-day"},{"rank":7,"player_id":605141,"player":"Mookie Betts","team":"LAD","avg":0.2,"hr":0,"rbi":0,"ops":0.533,"obp":0.333,"slg":0.2,"games":4,"pa":18,"sb":0,"window":"7-day"},{"rank":8,"player_id":606192,"player":"Teoscar Hern\u00e1ndez","team":"LAD","avg":0.214,"hr":0,"rbi":1,"ops":0.464,"obp":0.25,"slg":0.214,"games":4,"pa":16,"sb":0,"window":"7-day"},{"rank":9,"player_id":691406,"player":"Junior Caminero","team":"TB","avg":0.2,"hr":0,"rbi":2,"ops":0.538,"obp":0.238,"slg":0.3,"games":5,"pa":21,"sb":0,"window":"7-day"},{"rank":10,"player_id":694192,"player":"Jackson Chourio","team":"MIL","avg":0.158,"hr":1,"rbi":1,"ops":0.474,"obp":0.158,"slg":0.316,"games":4,"pa":19,"sb":0,"window":"7-day"}],"hot_pitchers":[{"rank":1,"player_id":676879,"player":"Aaron Ashby","team":"MIL","era":0.0,"ip":6.7,"k":6,"role":"closer","appearances":3,"gs":null,"sv":2,"bs":0,"sv_pct":1.0,"whip":null,"k9":null,"window":"7-day"},{"rank":2,"player_id":656730,"player":"Trevor Megill","team":"MIL","era":0.0,"ip":2.3,"k":2,"role":"closer","appearances":2,"gs":null,"sv":2,"bs":0,"sv_pct":1.0,"whip":null,"k9":null,"window":"7-day"},{"rank":3,"player_id":641329,"player":"Bryan Baker","team":"TB","era":0.0,"ip":2.0,"k":1,"role":"closer","appearances":2,"gs":null,"sv":2,"bs":0,"sv_pct":1.0,"whip":null,"k9":null,"window":"7-day"},{"rank":4,"player_id":656876,"player":"Drew Rasmussen","team":"TB","era":2.08,"ip":13.0,"k":13,"role":"starter","appearances":null,"gs":2,"sv":null,"bs":null,"sv_pct":null,"whip":1.0,"k9":9.0,"window":"7-day"},{"rank":5,"player_id":800048,"player":"Parker Messick","team":"CLE","era":2.57,"ip":7.0,"k":6,"role":"starter","appearances":null,"gs":2,"sv":null,"bs":null,"sv_pct":null,"whip":2.14,"k9":7.7,"window":"7-day"}],"cold_pitchers":[],"breakout_hitters":[{"rank":1,"player_id":800050,"player":"Chase DeLauter","team":"CLE","avg":0.297,"hr":1,"rbi":6,"ops":0.828,"obp":0.395,"slg":0.432,"games":10,"pa":43,"sb":0,"window":"15-day"},{"rank":2,"player_id":641343,"player":"Jake Bauers","team":"MIL","avg":0.269,"hr":1,"rbi":6,"ops":0.835,"obp":0.412,"slg":0.423,"games":8,"pa":34,"sb":0,"window":"15-day"},{"rank":3,"player_id":661388,"player":"William Contreras","team":"MIL","avg":0.367,"hr":3,"rbi":5,"ops":1.157,"obp":0.457,"slg":0.7,"games":8,"pa":35,"sb":0,"window":"15-day"},{"rank":4,"player_id":668930,"player":"Brice Turang","team":"MIL","avg":0.222,"hr":1,"rbi":2,"ops":0.742,"obp":0.371,"slg":0.37,"games":8,"pa":35,"sb":1,"window":"15-day"},{"rank":5,"player_id":650490,"player":"Yandy D\u00edaz","team":"TB","avg":0.314,"hr":1,"rbi":2,"ops":0.848,"obp":0.333,"slg":0.514,"games":8,"pa":36,"sb":0,"window":"15-day"},{"rank":6,"player_id":802415,"player":"Chandler Simpson","team":"TB","avg":0.238,"hr":0,"rbi":4,"ops":0.631,"obp":0.25,"slg":0.381,"games":7,"pa":24,"sb":2,"window":"15-day"},{"rank":7,"player_id":608070,"player":"Jos\u00e9 Ram\u00edrez","team":"CLE","avg":0.324,"hr":2,"rbi":8,"ops":0.986,"obp":0.419,"slg":0.568,"games":10,"pa":43,"sb":3,"window":"15-day"},{"rank":8,"player_id":660271,"player":"Shohei Ohtani","team":"LAD","avg":0.192,"hr":1,"rbi":3,"ops":0.589,"obp":0.281,"slg":0.308,"games":8,"pa":32,"sb":1,"window":"15-day"},{"rank":9,"player_id":672275,"player":"Patrick Bailey","team":"CLE","avg":0.3,"hr":2,"rbi":3,"ops":0.844,"obp":0.344,"slg":0.5,"games":10,"pa":32,"sb":0,"window":"15-day"}],"breakout_pitchers":[{"rank":1,"player_id":676879,"player":"Aaron Ashby","team":"MIL","era":0.0,"ip":6.7,"k":6,"role":"closer","appearances":3,"gs":null,"sv":2,"bs":0,"sv_pct":1.0,"whip":null,"k9":null,"window":"15-day"},{"rank":2,"player_id":656730,"player":"Trevor Megill","team":"MIL","era":0.0,"ip":4.7,"k":6,"role":"closer","appearances":4,"gs":null,"sv":4,"bs":0,"sv_pct":1.0,"whip":null,"k9":null,"window":"15-day"},{"rank":3,"player_id":641329,"player":"Bryan Baker","team":"TB","era":0.0,"ip":5.0,"k":5,"role":"closer","appearances":5,"gs":null,"sv":5,"bs":0,"sv_pct":1.0,"whip":null,"k9":null,"window":"15-day"},{"rank":4,"player_id":656876,"player":"Drew Rasmussen","team":"TB","era":1.29,"ip":21.0,"k":23,"role":"starter","appearances":null,"gs":3,"sv":null,"bs":null,"sv_pct":null,"whip":0.76,"k9":9.9,"window":"15-day"}]}}