{"meta":{"date":"2026-05-23","generated_at":"2026-06-17T00:06:06.940984+00:00","season":"2026"},"scores":[],"storylines":[],"tonight":[],"transactions":[],"leaderboards":{"hot_hitters":[{"rank":1,"player_id":606466,"player":"Ketel Marte","team":"AZ","avg":0.5,"hr":3,"rbi":7,"ops":1.615,"obp":0.565,"slg":1.05,"games":5,"pa":23,"sb":0,"window":"7-day"},{"rank":2,"player_id":606192,"player":"Teoscar Hern\u00e1ndez","team":"LAD","avg":0.429,"hr":2,"rbi":8,"ops":1.399,"obp":0.471,"slg":0.929,"games":4,"pa":17,"sb":0,"window":"7-day"},{"rank":3,"player_id":665742,"player":"Juan Soto","team":"NYM","avg":0.353,"hr":4,"rbi":5,"ops":1.48,"obp":0.421,"slg":1.059,"games":5,"pa":19,"sb":1,"window":"7-day"},{"rank":4,"player_id":701762,"player":"Nick Kurtz","team":"ATH","avg":0.471,"hr":0,"rbi":8,"ops":1.197,"obp":0.609,"slg":0.588,"games":5,"pa":23,"sb":1,"window":"7-day"},{"rank":5,"player_id":607043,"player":"Brandon Nimmo","team":"TEX","avg":0.412,"hr":2,"rbi":5,"ops":1.271,"obp":0.389,"slg":0.882,"games":4,"pa":18,"sb":0,"window":"7-day"},{"rank":6,"player_id":691023,"player":"Jordan Walker","team":"STL","avg":0.316,"hr":2,"rbi":8,"ops":1.018,"obp":0.333,"slg":0.684,"games":5,"pa":21,"sb":0,"window":"7-day"},{"rank":7,"player_id":671739,"player":"Michael Harris II","team":"ATL","avg":0.333,"hr":3,"rbi":5,"ops":1.042,"obp":0.333,"slg":0.708,"games":5,"pa":24,"sb":1,"window":"7-day"},{"rank":8,"player_id":518692,"player":"Freddie Freeman","team":"LAD","avg":0.417,"hr":2,"rbi":3,"ops":1.778,"obp":0.611,"slg":1.167,"games":4,"pa":18,"sb":1,"window":"7-day"},{"rank":9,"player_id":680776,"player":"Jarren Duran","team":"BOS","avg":0.294,"hr":2,"rbi":6,"ops":1.224,"obp":0.4,"slg":0.824,"games":4,"pa":20,"sb":1,"window":"7-day"},{"rank":10,"player_id":575929,"player":"Willson Contreras","team":"BOS","avg":0.5,"hr":0,"rbi":4,"ops":1.279,"obp":0.529,"slg":0.75,"games":4,"pa":17,"sb":0,"window":"7-day"}],"cold_hitters":[{"rank":1,"player_id":683737,"player":"Michael Busch","team":"CHC","avg":0.0,"hr":0,"rbi":0,"ops":0.125,"obp":0.125,"slg":0.0,"games":4,"pa":16,"sb":0,"window":"7-day"},{"rank":2,"player_id":592450,"player":"Aaron Judge","team":"NYY","avg":0.0,"hr":0,"rbi":0,"ops":0.118,"obp":0.118,"slg":0.0,"games":4,"pa":17,"sb":0,"window":"7-day"},{"rank":3,"player_id":672960,"player":"Kazuma Okamoto","team":"TOR","avg":0.0,"hr":0,"rbi":0,"ops":0.059,"obp":0.059,"slg":0.0,"games":4,"pa":17,"sb":0,"window":"7-day"},{"rank":4,"player_id":680574,"player":"Matt McLain","team":"CIN","avg":0.0,"hr":0,"rbi":1,"ops":0.0,"obp":0.0,"slg":0.0,"games":3,"pa":15,"sb":0,"window":"7-day"},{"rank":5,"player_id":592885,"player":"Christian Yelich","team":"MIL","avg":0.062,"hr":0,"rbi":0,"ops":0.292,"obp":0.167,"slg":0.125,"games":4,"pa":18,"sb":0,"window":"7-day"},{"rank":6,"player_id":670541,"player":"Yordan Alvarez","team":"HOU","avg":0.077,"hr":0,"rbi":0,"ops":0.327,"obp":0.25,"slg":0.077,"games":4,"pa":16,"sb":0,"window":"7-day"},{"rank":7,"player_id":681393,"player":"Connor Norby","team":"MIA","avg":0.077,"hr":0,"rbi":0,"ops":0.277,"obp":0.2,"slg":0.077,"games":4,"pa":15,"sb":1,"window":"7-day"},{"rank":8,"player_id":682657,"player":"Angel Mart\u00ednez","team":"CLE","avg":0.053,"hr":0,"rbi":1,"ops":0.208,"obp":0.05,"slg":0.158,"games":5,"pa":20,"sb":0,"window":"7-day"},{"rank":9,"player_id":691026,"player":"Masyn Winn","team":"STL","avg":0.071,"hr":0,"rbi":1,"ops":0.294,"obp":0.222,"slg":0.071,"games":4,"pa":18,"sb":0,"window":"7-day"},{"rank":10,"player_id":669127,"player":"Shea Langeliers","team":"ATH","avg":0.105,"hr":0,"rbi":0,"ops":0.419,"obp":0.208,"slg":0.211,"games":5,"pa":24,"sb":0,"window":"7-day"}],"hot_pitchers":[{"rank":1,"player_id":656546,"player":"Jeff Hoffman","team":"TOR","era":0.0,"ip":2.7,"k":5,"role":"closer","appearances":3,"gs":null,"sv":2,"bs":0,"sv_pct":1.0,"whip":null,"k9":null,"window":"7-day"},{"rank":2,"player_id":671922,"player":"Cade Smith","team":"CLE","era":0.0,"ip":3.0,"k":5,"role":"closer","appearances":3,"gs":null,"sv":3,"bs":0,"sv_pct":1.0,"whip":null,"k9":null,"window":"7-day"},{"rank":3,"player_id":690986,"player":"Kyle Harrison","team":"MIL","era":0.0,"ip":7.0,"k":11,"role":"starter","appearances":null,"gs":1,"sv":null,"bs":null,"sv_pct":null,"whip":0.43,"k9":14.1,"window":"7-day"},{"rank":4,"player_id":663992,"player":"Richard Lovelady","team":"WSH","era":0.0,"ip":2.0,"k":2,"role":"closer","appearances":2,"gs":null,"sv":2,"bs":0,"sv_pct":1.0,"whip":null,"k9":null,"window":"7-day"},{"rank":5,"player_id":623149,"player":"Paul Sewald","team":"AZ","era":0.0,"ip":2.0,"k":2,"role":"closer","appearances":2,"gs":null,"sv":2,"bs":0,"sv_pct":1.0,"whip":null,"k9":null,"window":"7-day"},{"rank":6,"player_id":641329,"player":"Bryan Baker","team":"TB","era":0.0,"ip":2.0,"k":2,"role":"closer","appearances":2,"gs":null,"sv":2,"bs":0,"sv_pct":1.0,"whip":null,"k9":null,"window":"7-day"},{"rank":7,"player_id":668909,"player":"Gavin Williams","team":"CLE","era":0.0,"ip":8.0,"k":11,"role":"starter","appearances":null,"gs":1,"sv":null,"bs":null,"sv_pct":null,"whip":0.5,"k9":12.4,"window":"7-day"},{"rank":8,"player_id":687911,"player":"Bryan King","team":"HOU","era":0.0,"ip":3.3,"k":2,"role":"closer","appearances":3,"gs":null,"sv":2,"bs":0,"sv_pct":1.0,"whip":null,"k9":null,"window":"7-day"},{"rank":9,"player_id":686973,"player":"Louis Varland","team":"TOR","era":3.0,"ip":3.0,"k":5,"role":"closer","appearances":2,"gs":null,"sv":2,"bs":0,"sv_pct":1.0,"whip":null,"k9":null,"window":"7-day"},{"rank":10,"player_id":676974,"player":"Max Meyer","team":"MIA","era":0.0,"ip":7.0,"k":8,"role":"starter","appearances":null,"gs":1,"sv":null,"bs":null,"sv_pct":null,"whip":0.57,"k9":10.3,"window":"7-day"}],"cold_pitchers":[{"rank":1,"player_id":666661,"player":"Juan Morillo","team":"AZ","era":18.0,"ip":1.0,"k":2,"role":"closer","appearances":2,"gs":null,"sv":0,"bs":2,"sv_pct":0.0,"whip":null,"k9":null,"window":"7-day"},{"rank":2,"player_id":669194,"player":"Ryne Nelson","team":"AZ","era":3.86,"ip":7.0,"k":3,"role":"starter","appearances":null,"gs":1,"sv":null,"bs":null,"sv_pct":null,"whip":1.43,"k9":3.9,"window":"7-day"}],"breakout_hitters":[{"rank":1,"player_id":606466,"player":"Ketel Marte","team":"AZ","avg":0.5,"hr":3,"rbi":7,"ops":1.615,"obp":0.565,"slg":1.05,"games":5,"pa":23,"sb":0,"window":"15-day"},{"rank":2,"player_id":606192,"player":"Teoscar Hern\u00e1ndez","team":"LAD","avg":0.429,"hr":2,"rbi":8,"ops":1.399,"obp":0.471,"slg":0.929,"games":4,"pa":17,"sb":0,"window":"15-day"},{"rank":3,"player_id":665742,"player":"Juan Soto","team":"NYM","avg":0.353,"hr":4,"rbi":5,"ops":1.48,"obp":0.421,"slg":1.059,"games":5,"pa":19,"sb":1,"window":"15-day"},{"rank":4,"player_id":701762,"player":"Nick Kurtz","team":"ATH","avg":0.471,"hr":0,"rbi":8,"ops":1.197,"obp":0.609,"slg":0.588,"games":5,"pa":23,"sb":1,"window":"15-day"},{"rank":5,"player_id":607043,"player":"Brandon Nimmo","team":"TEX","avg":0.412,"hr":2,"rbi":5,"ops":1.271,"obp":0.389,"slg":0.882,"games":4,"pa":18,"sb":0,"window":"15-day"},{"rank":6,"player_id":691023,"player":"Jordan Walker","team":"STL","avg":0.316,"hr":2,"rbi":8,"ops":1.018,"obp":0.333,"slg":0.684,"games":5,"pa":21,"sb":0,"window":"15-day"},{"rank":7,"player_id":671739,"player":"Michael Harris II","team":"ATL","avg":0.333,"hr":3,"rbi":5,"ops":1.042,"obp":0.333,"slg":0.708,"games":5,"pa":24,"sb":1,"window":"15-day"},{"rank":8,"player_id":518692,"player":"Freddie Freeman","team":"LAD","avg":0.417,"hr":2,"rbi":3,"ops":1.778,"obp":0.611,"slg":1.167,"games":4,"pa":18,"sb":1,"window":"15-day"},{"rank":9,"player_id":680776,"player":"Jarren Duran","team":"BOS","avg":0.294,"hr":2,"rbi":6,"ops":1.224,"obp":0.4,"slg":0.824,"games":4,"pa":20,"sb":1,"window":"15-day"},{"rank":10,"player_id":575929,"player":"Willson Contreras","team":"BOS","avg":0.5,"hr":0,"rbi":4,"ops":1.279,"obp":0.529,"slg":0.75,"games":4,"pa":17,"sb":0,"window":"15-day"}],"breakout_pitchers":[{"rank":1,"player_id":656546,"player":"Jeff Hoffman","team":"TOR","era":0.0,"ip":2.7,"k":5,"role":"closer","appearances":3,"gs":null,"sv":2,"bs":0,"sv_pct":1.0,"whip":null,"k9":null,"window":"15-day"},{"rank":2,"player_id":671922,"player":"Cade Smith","team":"CLE","era":0.0,"ip":3.0,"k":5,"role":"closer","appearances":3,"gs":null,"sv":3,"bs":0,"sv_pct":1.0,"whip":null,"k9":null,"window":"15-day"},{"rank":3,"player_id":690986,"player":"Kyle Harrison","team":"MIL","era":0.0,"ip":7.0,"k":11,"role":"starter","appearances":null,"gs":1,"sv":null,"bs":null,"sv_pct":null,"whip":0.43,"k9":14.1,"window":"15-day"},{"rank":4,"player_id":663992,"player":"Richard Lovelady","team":"WSH","era":0.0,"ip":2.0,"k":2,"role":"closer","appearances":2,"gs":null,"sv":2,"bs":0,"sv_pct":1.0,"whip":null,"k9":null,"window":"15-day"},{"rank":5,"player_id":623149,"player":"Paul Sewald","team":"AZ","era":0.0,"ip":2.0,"k":2,"role":"closer","appearances":2,"gs":null,"sv":2,"bs":0,"sv_pct":1.0,"whip":null,"k9":null,"window":"15-day"},{"rank":6,"player_id":641329,"player":"Bryan Baker","team":"TB","era":0.0,"ip":2.0,"k":2,"role":"closer","appearances":2,"gs":null,"sv":2,"bs":0,"sv_pct":1.0,"whip":null,"k9":null,"window":"15-day"},{"rank":7,"player_id":668909,"player":"Gavin Williams","team":"CLE","era":0.0,"ip":8.0,"k":11,"role":"starter","appearances":null,"gs":1,"sv":null,"bs":null,"sv_pct":null,"whip":0.5,"k9":12.4,"window":"15-day"},{"rank":8,"player_id":687911,"player":"Bryan King","team":"HOU","era":0.0,"ip":3.3,"k":2,"role":"closer","appearances":3,"gs":null,"sv":2,"bs":0,"sv_pct":1.0,"whip":null,"k9":null,"window":"15-day"},{"rank":9,"player_id":686973,"player":"Louis Varland","team":"TOR","era":3.0,"ip":3.0,"k":5,"role":"closer","appearances":2,"gs":null,"sv":2,"bs":0,"sv_pct":1.0,"whip":null,"k9":null,"window":"15-day"},{"rank":10,"player_id":676974,"player":"Max Meyer","team":"MIA","era":0.0,"ip":7.0,"k":8,"role":"starter","appearances":null,"gs":1,"sv":null,"bs":null,"sv_pct":null,"whip":0.57,"k9":10.3,"window":"15-day"}]}}