{"meta":{"date":"2026-10-11","generated_at":"2026-10-12T19:13:37.861240+00:00","season":"2026"},"scores":[{"away":"LAD","away_score":1,"home":"MIL","home_score":2,"final":true,"tag":"Pitchers' Duel"}],"storylines":[{"matchup":"LAD @ MIL","score":"1-2","tag":"Pitchers' Duel","body":"Los Angeles Dodgers 1, Milwaukee Brewers 2. DL Hall earned the win. Key moment: Mookie Betts flies out to center fielder Garrett Mitchell.."}],"tonight":[{"matchup":"LAD @ MIL","broadcast":"FOX / FOX ONE","note":"Los Angeles Dodgers at Milwaukee Brewers. Yoshinobu Yamamoto vs Logan Henderson. National broadcast on FOX / FOX ONE."}],"transactions":[],"leaderboards":{"hot_hitters":[{"rank":1,"player_id":608070,"player":"Jos\u00e9 Ram\u00edrez","team":"CLE","avg":0.333,"hr":2,"rbi":7,"ops":1.378,"obp":0.444,"slg":0.933,"games":4,"pa":18,"sb":1,"window":"7-day"},{"rank":2,"player_id":666176,"player":"Jo Adell","team":"CLE","avg":0.333,"hr":0,"rbi":6,"ops":1.044,"obp":0.444,"slg":0.6,"games":4,"pa":18,"sb":0,"window":"7-day"},{"rank":3,"player_id":518692,"player":"Freddie Freeman","team":"LAD","avg":0.25,"hr":2,"rbi":2,"ops":0.919,"obp":0.294,"slg":0.625,"games":4,"pa":17,"sb":0,"window":"7-day"},{"rank":4,"player_id":681624,"player":"Andy Pages","team":"LAD","avg":0.357,"hr":0,"rbi":3,"ops":0.757,"obp":0.4,"slg":0.357,"games":4,"pa":15,"sb":0,"window":"7-day"},{"rank":5,"player_id":672275,"player":"Patrick Bailey","team":"CLE","avg":0.286,"hr":1,"rbi":2,"ops":0.833,"obp":0.333,"slg":0.5,"games":4,"pa":15,"sb":0,"window":"7-day"},{"rank":6,"player_id":661388,"player":"William Contreras","team":"MIL","avg":0.312,"hr":1,"rbi":1,"ops":0.889,"obp":0.389,"slg":0.5,"games":4,"pa":18,"sb":0,"window":"7-day"},{"rank":7,"player_id":678246,"player":"Miguel Vargas","team":"CWS","avg":0.273,"hr":1,"rbi":1,"ops":1.101,"obp":0.556,"slg":0.545,"games":4,"pa":18,"sb":1,"window":"7-day"},{"rank":8,"player_id":694192,"player":"Jackson Chourio","team":"MIL","avg":0.25,"hr":0,"rbi":4,"ops":0.513,"obp":0.263,"slg":0.25,"games":4,"pa":19,"sb":0,"window":"7-day"},{"rank":9,"player_id":800050,"player":"Chase DeLauter","team":"CLE","avg":0.312,"hr":0,"rbi":2,"ops":0.701,"obp":0.389,"slg":0.312,"games":4,"pa":18,"sb":0,"window":"7-day"},{"rank":10,"player_id":803011,"player":"Sam Antonacci","team":"CWS","avg":0.25,"hr":0,"rbi":3,"ops":0.485,"obp":0.235,"slg":0.25,"games":4,"pa":17,"sb":0,"window":"7-day"}],"cold_hitters":[{"rank":1,"player_id":669257,"player":"Will Smith","team":"LAD","avg":0.067,"hr":0,"rbi":0,"ops":0.192,"obp":0.125,"slg":0.067,"games":4,"pa":16,"sb":0,"window":"7-day"},{"rank":2,"player_id":683953,"player":"Travis Bazzana","team":"CLE","avg":0.083,"hr":0,"rbi":1,"ops":0.433,"obp":0.267,"slg":0.167,"games":4,"pa":15,"sb":0,"window":"7-day"},{"rank":3,"player_id":660271,"player":"Shohei Ohtani","team":"LAD","avg":0.167,"hr":0,"rbi":0,"ops":0.479,"obp":0.312,"slg":0.167,"games":4,"pa":16,"sb":1,"window":"7-day"},{"rank":4,"player_id":641343,"player":"Jake Bauers","team":"MIL","avg":0.167,"hr":0,"rbi":0,"ops":0.578,"obp":0.412,"slg":0.167,"games":4,"pa":17,"sb":0,"window":"7-day"},{"rank":5,"player_id":695657,"player":"Colson Montgomery","team":"CWS","avg":0.167,"hr":0,"rbi":0,"ops":0.367,"obp":0.2,"slg":0.167,"games":4,"pa":15,"sb":0,"window":"7-day"},{"rank":6,"player_id":663993,"player":"Nathaniel Lowe","team":"CLE","avg":0.154,"hr":0,"rbi":1,"ops":0.507,"obp":0.353,"slg":0.154,"games":4,"pa":17,"sb":0,"window":"7-day"},{"rank":7,"player_id":606192,"player":"Teoscar Hern\u00e1ndez","team":"LAD","avg":0.188,"hr":0,"rbi":0,"ops":0.375,"obp":0.188,"slg":0.188,"games":4,"pa":16,"sb":0,"window":"7-day"},{"rank":8,"player_id":808959,"player":"Munetaka Murakami","team":"CWS","avg":0.133,"hr":0,"rbi":2,"ops":0.369,"obp":0.235,"slg":0.133,"games":4,"pa":17,"sb":1,"window":"7-day"},{"rank":9,"player_id":677587,"player":"Brayan Rocchio","team":"CLE","avg":0.167,"hr":0,"rbi":1,"ops":0.433,"obp":0.267,"slg":0.167,"games":4,"pa":15,"sb":1,"window":"7-day"},{"rank":10,"player_id":605141,"player":"Mookie Betts","team":"LAD","avg":0.2,"hr":0,"rbi":0,"ops":0.533,"obp":0.333,"slg":0.2,"games":4,"pa":18,"sb":0,"window":"7-day"}],"hot_pitchers":[{"rank":1,"player_id":656730,"player":"Trevor Megill","team":"MIL","era":0.0,"ip":2.0,"k":2,"role":"closer","appearances":2,"gs":null,"sv":2,"bs":0,"sv_pct":1.0,"whip":null,"k9":null,"window":"7-day"},{"rank":2,"player_id":641329,"player":"Bryan Baker","team":"TB","era":0.0,"ip":2.0,"k":2,"role":"closer","appearances":2,"gs":null,"sv":2,"bs":0,"sv_pct":1.0,"whip":null,"k9":null,"window":"7-day"},{"rank":3,"player_id":621242,"player":"Edwin D\u00edaz","team":"LAD","era":0.0,"ip":2.0,"k":1,"role":"closer","appearances":2,"gs":null,"sv":2,"bs":0,"sv_pct":1.0,"whip":null,"k9":null,"window":"7-day"},{"rank":4,"player_id":808967,"player":"Yoshinobu Yamamoto","team":"LAD","era":1.29,"ip":7.0,"k":10,"role":"starter","appearances":null,"gs":1,"sv":null,"bs":null,"sv_pct":null,"whip":0.71,"k9":12.9,"window":"7-day"},{"rank":5,"player_id":668909,"player":"Gavin Williams","team":"CLE","era":1.69,"ip":10.7,"k":23,"role":"starter","appearances":null,"gs":2,"sv":null,"bs":null,"sv_pct":null,"whip":0.94,"k9":19.4,"window":"7-day"}],"cold_pitchers":[],"breakout_hitters":[{"rank":1,"player_id":608070,"player":"Jos\u00e9 Ram\u00edrez","team":"CLE","avg":0.258,"hr":2,"rbi":9,"ops":0.9,"obp":0.351,"slg":0.548,"games":8,"pa":37,"sb":2,"window":"15-day"},{"rank":2,"player_id":666176,"player":"Jo Adell","team":"CLE","avg":0.265,"hr":1,"rbi":7,"ops":0.875,"obp":0.375,"slg":0.5,"games":9,"pa":40,"sb":1,"window":"15-day"},{"rank":3,"player_id":518692,"player":"Freddie Freeman","team":"LAD","avg":0.233,"hr":2,"rbi":2,"ops":0.715,"obp":0.281,"slg":0.433,"games":8,"pa":32,"sb":0,"window":"15-day"},{"rank":4,"player_id":681624,"player":"Andy Pages","team":"LAD","avg":0.267,"hr":2,"rbi":8,"ops":0.81,"obp":0.343,"slg":0.467,"games":9,"pa":35,"sb":1,"window":"15-day"},{"rank":5,"player_id":672275,"player":"Patrick Bailey","team":"CLE","avg":0.28,"hr":3,"rbi":5,"ops":0.973,"obp":0.333,"slg":0.64,"games":9,"pa":27,"sb":0,"window":"15-day"},{"rank":6,"player_id":661388,"player":"William Contreras","team":"MIL","avg":0.276,"hr":2,"rbi":3,"ops":0.865,"obp":0.382,"slg":0.483,"games":8,"pa":34,"sb":0,"window":"15-day"},{"rank":7,"player_id":678246,"player":"Miguel Vargas","team":"CWS","avg":0.188,"hr":1,"rbi":4,"ops":0.707,"obp":0.426,"slg":0.281,"games":10,"pa":47,"sb":3,"window":"15-day"},{"rank":8,"player_id":694192,"player":"Jackson Chourio","team":"MIL","avg":0.4,"hr":2,"rbi":11,"ops":1.029,"obp":0.429,"slg":0.6,"games":9,"pa":35,"sb":1,"window":"15-day"},{"rank":9,"player_id":800050,"player":"Chase DeLauter","team":"CLE","avg":0.219,"hr":1,"rbi":4,"ops":0.668,"obp":0.324,"slg":0.344,"games":8,"pa":37,"sb":0,"window":"15-day"},{"rank":10,"player_id":803011,"player":"Sam Antonacci","team":"CWS","avg":0.361,"hr":0,"rbi":5,"ops":0.772,"obp":0.356,"slg":0.417,"games":11,"pa":45,"sb":1,"window":"15-day"}],"breakout_pitchers":[{"rank":1,"player_id":656730,"player":"Trevor Megill","team":"MIL","era":0.0,"ip":3.3,"k":4,"role":"closer","appearances":3,"gs":null,"sv":3,"bs":0,"sv_pct":1.0,"whip":null,"k9":null,"window":"15-day"},{"rank":2,"player_id":641329,"player":"Bryan Baker","team":"TB","era":0.0,"ip":4.0,"k":4,"role":"closer","appearances":4,"gs":null,"sv":4,"bs":0,"sv_pct":1.0,"whip":null,"k9":null,"window":"15-day"},{"rank":3,"player_id":621242,"player":"Edwin D\u00edaz","team":"LAD","era":0.0,"ip":2.0,"k":1,"role":"closer","appearances":2,"gs":null,"sv":2,"bs":0,"sv_pct":1.0,"whip":null,"k9":null,"window":"15-day"},{"rank":4,"player_id":808967,"player":"Yoshinobu Yamamoto","team":"LAD","era":1.29,"ip":7.0,"k":10,"role":"starter","appearances":null,"gs":1,"sv":null,"bs":null,"sv_pct":null,"whip":0.71,"k9":12.9,"window":"15-day"}]}}